key,project,regular_text,text,oracle
1810,appreviews,excellent everything is awesome but so far i have found that whenever i turn on wifi my battery drains after using this software may it happens due to widgets or panel but if i turn off it doesn t happen ,excellent everything be awesome but so far i have find that whenever i turn on wifi pron battery drain after use this software may pron happen due to widget or panel but if i turn off pron do not happen ,1
1811,appreviews,poor bakvas interface and very very slow app ,poor bakvas interface and very very slow app ,-1
1812,appreviews,this app is a waste of time i can log in but it always freezes and eventually crashes i do not feel confident with the security on this app if wf can leave us hanging with a horrible app for such a big bank uninstalled htc one,this app be a waste of time i can log in but pron always freeze and eventually crash i do not feel confident with the security on this app if wf can leave pron hang with a horrible app for such a big bank uninstall htc one,-1
1813,appreviews,bugs in latest update great app until last update that drain battery and continue to use huge amount of data at the background ,bug in late update great app until last update that drain battery and continue to use huge amount of datum at the background ,-1
1814,appreviews,app is slow it it not well organized the categories like shooters there is only one witch is incorrect and its slow it freezes scrolling is glitchy etc ,app be slow pron pron not well organize the category like shooter there be only one witch be incorrect and pron slow pron freeze scroll be glitchy etc ,-1
1815,appreviews,amazing awesome app for mathematics worth thousand starts thanks devs though the ui is hard to understand thanks for the small size,amazing awesome app for mathematic worth thousand start thank devs though the ui be hard to understand thank for the small size,1
1816,appreviews,battery emptied my battery for 50 in 1 hour while phone was in standby don t know how but had to remove in immediately sorry ,battery empty pron battery for 50 in 1 hour while phone be in standby do not know how but have to remove in immediately sorry ,-1
1817,appreviews,good app great launcher i really like it but it is killing my battery ,good app great launcher i really like pron but pron be kill pron battery ,0
1818,appreviews,great alarm but has new bug making it use lots of battery i like this alarm i definitely like being able to wake up to a random playlist but since an update its now using massive amounts of battery using the gps i m guessing it s something to do with sunrise feature i don t use the sunrise alarm and i certainly don t move between countries enough for it to constantly be updating so either a setting to not allow access to gps or to only update once a day would be useful otherwise i ll have to go back to the standard alarm until it s fixed ,great alarm but have new bug make pron use lot of battery i like this alarm i definitely like be able to wake up to a random playlist but since an update pron now use massive amount of battery use the gps pron be guess pron be something to do with sunrise feature i do not use the sunrise alarm and i certainly do not move between country enough for pron to constantly be update so either a setting to not allow access to gps or to only update once a day would be useful otherwise pron will have to go back to the standard alarm until pron be fix ,0
1819,appreviews,addictive freezes sometimes annoying having to wait for the lives to recharge,addictive freeze sometimes annoying have to wait for the life to recharge,-1
1820,appreviews,i love it but i would love to make this my default sms app i m an old textra and chomp user only gripe is need a lot of improvement like bubble chats even u don t make it bubble it s ok just have a bit of space bet messages cause it is confusing and cluttered to look at then also led notification that s one thing that keeps me from using this as a daily driver we need better notifications this app is worth 5 stars i d even buy it if it had a price just to have it full featured and also text counts on icon,i love pron but i would love to make this pron default sm app pron be an old textra and chomp user only gripe be need a lot of improvement like bubble chat even u do not make pron bubble pron be ok just have a bit of space bet message because pron be confusing and clutter to look at then also lead notification that be one thing that keep pron from use this as a daily driver pron need good notification this app be worth 5 stars pron would even buy pron if pron have a price just to have pron full featured and also text count on icon,1
1821,appreviews,very fun worth the memory d,very fun worth the memory d,1
1822,appreviews, horrible on moment my battery dies faster , horrible on moment pron battery die faster ,-1
1823,appreviews, eats battery life like the cookie monster eats cookies has the most features of any other system app slows the system to a crawl unistalled , eat battery life like the cookie monster eat cookie have the most feature of any other system app slow the system to a crawl unistalled ,-1
1824,appreviews,excellent app but drains battery this app works really well and does exactly what s it says it does the only problem i had was that it drained my battery a lot cause it is constantly running ,excellent app but drain battery this app work really well and do exactly what be pron say pron do the only problem i have be that pron drain pron battery a lot because pron be constantly run ,0
1825,appreviews,there is room for improvement the good thing it lets you know when your moga pro has been connected to your android device and it displays current games that support the controller the bad thing a its interface it s boring even my 14yr old cousin can make it look like tegra zone based stylish themed or better b the bluetooth connection when i m using the game the controller loses the connection with it for too long so i have to press the moga button and try to reconnect or it happens for a few seconds and while i m using the controller my notification keeps showing the controller has been connected to my tablet c the moga pivot connects the controller to the android device but why on earth does it not display the controller battery life how much longer can my controller s built in battery last it should let me know d just let me know whenever a new game has support for the controller i m talking about pivot running in the background self updating its catalog and pushing a notification warning me a new game has entered the supported games list it d be great e sometimes the controller takes too long to connect what s with the hold up please fix these issues they are worth a new update ,there be room for improvement the good thing pron let pron know when pron moga pro have be connect to pron android device and pron display current game that support the controller the bad thing a it interface pron be boring even pron 14yr old cousin can make pron look like tegra zone base stylish theme or good b the bluetooth connection when pron be use the game the controller lose the connection with pron for too long so i have to press the moga button and try to reconnect or pron happen for a few second and while pron be use the controller pron notification keep show the controller have be connect to pron tablet c the moga pivot connect the controller to the android device but why on earth do pron not display the controller battery life how much longer can pron controller s build in battery last pron should let pron know d just let pron know whenever a new game have support for the controller pron be talk about pivot run in the background self update pron catalog and push a notification warn pron a new game have enter the support game list pron would be great e sometimes the controller take too long to connect what be with the hold up please fix these issue pron be worth a new update ,0
1826,appreviews,great game its an amazing game but 4 1 ie impossible i know how to do it but there is such a small chance of doing it and for 3 7 you flick the battery to the plain box and the on the left side do the colours it said on the right and you do it for the otherside everytime you get it right you should hear a ding of some sort keep doing that untill the play button comes up toget 3 stars,great game pron an amazing game but 4 1 ie impossible i know how to do pron but there be such a small chance of do pron and for 3 7 pron flick the battery to the plain box and the on the left side do the colour pron say on the right and pron do pron for the otherside everytime pron get pron right pron should hear a ding of some sort keep do that untill the play button come up toget 3 star,1
1827,appreviews,good and bad it has virus ,good and bad pron have virus ,-1
1828,appreviews,great app major glitch the update was nice but it prevents my phone from going to sleep even when the app isn t open uninstalling the app fixed it but i miss it this app alone cut my battery life by more than 20 ,great app major glitch the update be nice but pron prevent pron phone from go to sleep even when the app be not open uninstall the app fix pron but i miss pron this app alone cut pron battery life by more than 20 ,-1
1829,appreviews,good app it s customizable which i like sometimes it s a bit difficult getting items to line up properly and the areas for each part of the display don t change size dynamically so the font sizes will get bigger or smaller to fit in the space alloted for them which i don t like overall it s a good app though ,good app pron be customizable which i like sometimes pron be a bit difficult get item to line up properly and the area for each part of the display do not change size dynamically so the font size will get big or small to fit in the space allot for pron which i do not like overall pron be a good app though ,1
1830,appreviews,battery issues the app will usually consume 20 25 of my battery constantly having to force stop ,battery issue the app will usually consume 20 25 of pron battery constantly have to force stop ,-1
1831,appreviews, cute but eats up alot of battery , cute but eat up alot of battery ,-1
1832,appreviews,needs work there should be a way to adjust the shape and location of the eyes cheeks and lips everyone s features are not shaped the same even with a well lit picture taken at the right angle your app proves inaccurate which is highly disappointing seeing as you are a big name cosmetic brand and not some rinky dink developer making a cheap advertising heavy app for little girls i expected more from mary kay and this type of one size fits all lack of attention to detail and diversity makes you look bad ,need work there should be a way to adjust the shape and location of the eye cheek and lip everyone s feature be not shape the same even with a well light picture take at the right angle pron app prove inaccurate which be highly disappointing see as pron be a big name cosmetic brand and not some rinky dink developer make a cheap advertising heavy app for little girl i expect more from mary kay and this type of one size fit all lack of attention to detail and diversity make pron look bad ,-1
1833,appreviews,ads great app but the ads come up all the time and it ruins it,ad great app but the ad come up all the time and pron ruin pron,-1
1834,appreviews,amazing well designed but confusing says i have a lot more free space than android reports ,amazing well design but confusing say i have a lot more free space than android report ,1
1835,appreviews,if only i m using this app on a note 10 1 and have also tried the obvious competition there are some features i really like and already miss in other apps especially the very well implemented blending and the in depth controls for setting pressure sensitivity the deal breaker for me at the moment noticeably worse brush lag than in other apps note there is actually a note mode which limits the area to the current tile and is much smoother but offers only a small selection of tools while active i d love to have that kind of performance with the full functionality within reason when it comes to more demanding bigger brushes short version love nearly everything about it and will definitely buy the full version when the performance gets improved ,if only pron be use this app on a note 10 1 and have also try the obvious competition there be some feature i really like and already miss in other app especially the very well implement blend and the in depth control for set pressure sensitivity the deal breaker for pron at the moment noticeably bad brush lag than in other app note there be actually a note mode which limit the area to the current tile and be much smooth but offer only a small selection of tool while active pron would love to have that kind of performance with the full functionality within reason when pron come to more demanding big brush short version love nearly everything about pron and will definitely buy the full version when the performance get improve ,1
1836,appreviews,regret buying this app fcs so randomly that it s almost impossible to use it for longer period of time lack of updates have made it even more impossible to use haven t seen even a single much requested feature by the community being implemented in this app despite being ok play store for more or less 4 months now disappointed ,regret buy this app fc so randomly that pron be almost impossible to use pron for long period of time lack of update have make pron even more impossible to use have not see even a single much request feature by the community be implement in this app despite be ok play store for more or less 4 month now disappoint ,-1
1837,appreviews, fails to download phone has sufficient memory and specs , fail to download phone have sufficient memory and spec ,-1
1838,appreviews,slow no point the viewfinder display is really laggy and slow doesn t seem to offer any creative black and white features so how does it improve over just desaturating color photos ,slow no point the viewfinder display be really laggy and slow do not seem to offer any creative black and white feature so how do pron improve over just desaturat color photo ,-1
1839,appreviews, convenient but very unfriendly to the battery, convenient but very unfriendly to the battery,-1
1840,appreviews,pages don t fill the screen well with the latest update i m now able to sign into the app on my galaxy s4 and it s considerably more stable and responsive on my nook hd but unfortunately now when i try to read comics the pages only take up about 2 3 of the screen s available real estate with black borders on the left right and bottom even if i pinch zoom to fill the screen when i move to the next page it goes back to the original size hopefully they can address that issue and then start adding some of the other standard features of comic readers update 8 26 13 today s update still doesn t resolve the issue with comics rendering in about 2 3 of the screen while i m happy to see that they ve doubled the number of issues you can have offline the first time i tried to open one the app crashed back to the launcher all in all this app is still completely unusable on android imo ,page do not fill the screen well with the late update pron be now able to sign into the app on pron galaxy s4 and pron be considerably more stable and responsive on pron nook hd but unfortunately now when i try to read comic the page only take up about 2 3 of the screen s available real estate with black border on the left right and bottom even if i pinch zoom to fill the screen when i move to the next page pron go back to the original size hopefully pron can address that issue and then start add some of the other standard feature of comic reader update 8 26 13 today s update still do not resolve the issue with comic render in about 2 3 of the screen while pron be happy to see that pron have double the number of issue pron can have offline the first time i try to open one the app crash back to the launcher all in all this app be still completely unusable on android imo ,-1
1841,jira,guys this is so stupid ,guy this be so stupid ,-1
1842,jira,I lost the whole morning cause HBase s RegionServer was dying with no logs no nothing how Am I supposed to debug the issue if u do not even generate a core dump ,pron lose the whole morning because hbase s regionserver be die with no log no nothing how be pron suppose to debug the issue if u do not even generate a core dump ,-1
1843,jira, quote You are messing down deep below hbase in dfs , quote you be mess down deep below hbase in dfs ,-1
1844,jira,And I think if we re going to do a sweep up of shit we should just kill root ,and pron think if pron be go to do a sweep up of shit pron should just kill root ,-1
1845,jira, idiot Yeah I was on that idiot path for a good while but commons lang is a hairball at least where this hashcode making and equals is concerned , idiot yeah pron be on that idiot path for a good while but commons lang be a hairball at least where this hashcode making and equal be concern ,-1
1846,jira,Pull it back in if you think different ,pull pron back in if pron think different ,-1
1847,jira,i suck ,i suck ,-1
1848,jira,Will still be stuck in the loop though if can t actually close regions ,will still be stick in the loop though if can not actually close region ,-1
1849,jira,Original edited patch was messed up stupid sed ,original edit patch be mess up stupid s ,-1
1850,jira,Who made this stupid rule ,who make this stupid rule ,-1
1851,jira,Sorry but this is just stupid ,sorry but this be just stupid ,-1
1852,jira,But I will quit committing to Hama then because I m not going to support ONLY a binary format ,but pron will quit commit to hama then because pron be not go to support only a binary format ,-1
1853,jira,This is not what I build a framework for ,this be not what pron build a framework for ,-1
1854,jira,Well damn ,well damn ,-1
1855,jira,Blooper after blooper I hate SVN ,bloop after blooper pron hate svn ,-1
1856,jira,This looks reasonable to me sucks we have to special case handling of ,this look reasonable to pron suck pron have to special case handling of ,-1
1857,jira,You may want to carefully examine your assumption about this ,pron may want to carefully examine pron assumption about this ,-1
1858,jira,Ok wow welcome to Linux hell ,ok wow welcome to linux hell ,-1
1859,jira,If I get a chance I may even roll it into our dev environment but I am currently in the middle of mem leak hell ,if pron get a chance pron may even roll pron into pron dev environment but pron be currently in the middle of mem leak hell ,-1
1860,jira,Both equally bad ,both equally bad ,-1
1861,jira,Negative I am against fetch groups in principle ,negative pron be against fetch group in principle ,-1
1862,jira,This way lies metadata hell ,this way lie metadata hell ,-1
1863,jira,Shit there is an dependency Please go to Preferences LDAP Entry Editor and enable the option Show operational attributes ,shit there be an dependency please go to preferences ldap entry editor and enable the option show operational attribute ,-1
1864,jira,Damn ,damn ,-1
1865,jira,Damn ,damn ,-1
1866,jira,Damn ,damn ,-1
1867,jira,The evil NPE strik back ,the evil npe strik back ,-1
1868,jira,Bloody hell ,bloody hell ,-1
1869,jira,Damn time has flown ,damn time have fly ,-1
1870,jira,Damn it ,damn pron ,-1
1871,jira,This was a very bad bug introduced by me being an idiot ,this be a very bad bug introduce by pron be an idiot ,-1
1872,jira,I have stupidly deleted the original test dir but judging from the suite s output files no output was created after 3 1 2 hours ,pron have stupidly delete the original test dir but judge from the suite s output file no output be create after 3 1 2 hour ,-1
1873,jira,damn this was assigned to you since months ,damn this be assign to pron since month ,-1
1874,jira,Imo all this just doesn t make sense from a pure performance aspect ,imo all this just do not make sense from a pure performance aspect ,-1
1875,jira,Inserting timestamps automagically would be bad because it would limit a whole swath of use cases ,insert timestamp automagically would be bad because pron would limit a whole swath of use case ,-1
1876,jira,If they do then Suse s cpio works for old ascii but the c switch is broken ,if pron do then suse s cpio work for old ascii but the c switch be break ,-1
1877,jira,This is pretty embarassing ,this be pretty embarassing ,-1
1878,jira,When you install a node module globally it goes into usr local where you don t have permissions to move shit into unless you sudo ,when pron install a node module globally pron go into usr local where pron do not have permission to move shit into unless pron sudo ,-1
1879,jira,That being said I m not totally opposed to making the limit configurable ,that be say pron be not totally opposed to make the limit configurable ,-1
1880,jira,My bad I screwed up the assertion RuntimeException transition ,pron bad pron screw up the assertion runtimeexception transition ,-1
1881,jira,Well that sucks ,well that suck ,-1
1882,jira,No it s not off the table but it s moot unless we decide we want cqlsh in tree at all ,no pron be not off the table but pron be moot unless pron decide pron want cqlsh in tree at all ,-1
1883,jira,Ok here is a patch that works I was stupid enough not to see it ,ok here be a patch that work pron be stupid enough not to see pron ,-1
1884,jira,It was a pretty stupid idea to use a static array of instances for QuorumOpMonitor ,pron be a pretty stupid idea to use a static array of instance for quorumopmonitor ,-1
1885,jira,All I m trying to say is that it s pretty easy to end up in propagation failure hell here or change something else that blows things up for use cases that are not foreseen ,all pron be try to say be that pron be pretty easy to end up in propagation failure hell here or change something else that blow thing up for use case that be not foresee ,-1
1886,jira,Just to clarify you made the DTPE handle exceptions the same way as CassandraDaemon by updating it to use NBHS instead of CSLS Did you just tell me to go fuck myself ,just to clarify pron make the dtpe handle exception the same way as cassandradaemon by update pron to use nbhs instead of csls do pron just tell pron to go fuck pron ,-1
1887,jira, 1 damn intellij it s not like patch format hasn t been standard for years , 1 damn intellij pron be not like patch format have not be standard for year ,-1
1888,jira,Wow it s like Thrift is going out of their way to make life suck for us this month ,wow pron be like thrift be go out of pron way to make life suck for pron this month ,-1
1889,jira,Here is quite bad ,here be quite bad ,-1
1890,jira, The samples you gave are different , the sample pron give be different ,-1
1891,jira,I just noticed your public tweet bq wilhelmbierbaum True Fuck the Avro C API ,pron just notice pron public tweet bq wilhelmbierbaum true fuck the avro c api ,-1
1892,jira,if so can you see if you can git bisect this bad boy ,if so can pron see if pron can git bisect this bad boy ,-1
1893,jira,It seems some of the wrappers in ink hrtime h might no longer be used either e g ink gettimeofday is never used so lets get rid of that shit ,pron seem some of the wrapper in ink hrtime h may no longer be use either e g ink gettimeofday be never use so let get rid of that shit ,-1
1894,jira,Heh that s one hell of a bug 275 bytes exactly eh ,heh that be one hell of a bug 275 byte exactly eh ,-1
1895,jira,What a stupid name I chose for that object ,what a stupid name pron choose for that object ,-1
1896,jira,I think it s time to just close this issue ,pron think pron be time to just close this issue ,-1
1897,jira,I m not entering bogus reports for the hell of it Matt,pron be not enter bogus report for the hell of pron matt,-1
1898,jira,I am currently trying to get it into AJDT dev builds but my git push is timing out damn thing ,pron be currently try to get pron into ajdt dev build but pron git push be time out damn thing ,-1
1899,jira,Stupid Maven,stupid maven,-1
1900,jira,Ok Stupid user Error here ,ok stupid user error here ,-1
1901,jira,Why the hell do they deliver Duration if they cannot instantiate it ,why the hell do pron deliver duration if pron can not instantiate pron ,-1
1902,jira,The defect from hell 666 be scared ,the defect from hell 666 be scared ,-1
1903,jira,This really sucks ,this really suck ,-1
1904,jira,Why the hell is this not a bug ,why the hell be this not a bug ,-1
1905,jira,What the hell are you waiting for ,what the hell be pron wait for ,-1
1906,jira,I suspect it has nothing to do with the file system connector or Infinispan connectors and is simply a stupid mistake in the federated join processor ,pron suspect pron have nothing to do with the file system connector or infinispan connector and be simply a stupid mistake in the federated join processor ,-1
1907,jira,I m an idiot ,pron be an idiot ,-1
1908,jira,It really sucks that there is now way currently to include transitive dependencies ,pron really suck that there be now way currently to include transitive dependency ,-1
1909,jira,I m an idiot there s nothing wrong with the readme txt ,pron be an idiot there be nothing wrong with the readme txt ,-1
1910,jira,Crap forgot to verify that this is inconsistant with MRI it s not ,crap forget to verify that this be inconsistant with mri pron be not ,-1
1911,jira,Please close as this is just me being stupid ,please close as this be just pron be stupid ,-1
1912,jira,Holy hell I think I found one problem with turning a bignum into anything else ,holy hell pron think pron find one problem with turn a bignum into anything else ,-1
1913,jira,This sucks so much ,this suck so much ,-1
