key,project,regular_text,text,oracle
1387,stackoverflow,Stable and production ready lib ,stable and production ready lib ,1
1388,stackoverflow,Not an extremely expensive operation I think ,not an extremely expensive operation pron think ,1
1389,stackoverflow,because it provides the lot of flexibility and improvements over using normal arrays ,because pron provide the lot of flexibility and improvement over use normal array ,1
1390,stackoverflow,This provides the method CODE FRAGMENT for inserting the element at specific location and it is very efficient ,this provide the method code fragment for insert the element at specific location and pron be very efficient ,1
1391,stackoverflow,Whatever you are talking about is best done by the CODE FRAGMENT WEB ADDRESS ,whatev pron be talk about be best do by the code fragment web address ,1
1392,stackoverflow,This will preserve the insertion order and insure no duplicates ,this will preserve the insertion order and insure no duplicate ,1
1393,stackoverflow,They both seem to print out the list fine ,pron both seem to print out the list fine ,1
1394,stackoverflow,Well a solution that works for me ,well a solution that work for pron ,1
1395,stackoverflow,Finally an IDE would be helpful for you ,finally an ide would be helpful for pron ,1
1396,stackoverflow,John Spurlock the create of OData4j personally responds to almost all of the posts there ,john spurlock the create of odata4j personally respond to almost all of the post there ,1
1397,stackoverflow,As for iOS development with OData the best out there is OData4ObjC ,as for ios development with odata the good out there be odata4objc ,1
1398,stackoverflow,CODE FRAGMENT overrides these methods so there is no fear that such an Exception will be thrown ,code fragment override these method so there be no fear that such an exception will be throw ,1
1399,stackoverflow,It s ok ,pron be ok ,1
1400,stackoverflow,Here s a set of solutions to this challenge for both JDK types and Eclipse Collections types using CODE FRAGMENT ,here be a set of solution to this challenge for both jdk type and eclipse collections type use code fragment ,1
1401,stackoverflow,Any of the 5 options listed there should work just fine though ,any of the 5 option list there should work just fine though ,1
1402,stackoverflow,I can assure you it works from within a web app and also within an application using the Spring framework ,pron can assure pron pron work from within a web app and also within an application use the spring framework ,1
1403,stackoverflow,take a look FILE NAME executors as these will help with your scheduling and remove the need for the sleep ,take a look file name executor as these will help with pron scheduling and remove the need for the sleep ,1
1404,stackoverflow,Useful links ,useful link ,1
1405,stackoverflow,Worked ,work ,1
1406,stackoverflow,Javolution Structs supports mapping of off heap memory as a data structure ,javolution structs support mapping of off heap memory as a data structure ,1
1407,stackoverflow,or more concisely ,or more concisely ,1
1408,stackoverflow,I suggest you to use ,pron suggest pron to use ,1
1409,stackoverflow,Follow the steps otherwise your code is fine ,follow the step otherwise pron code be fine ,1
1410,stackoverflow,This works for me ,this work for pron ,1
1411,stackoverflow,For me this worked ,for pron this work ,1
1412,stackoverflow,Specifically for bower there looks to be a good maven plugin here ,specifically for bower there look to be a good maven plugin here ,1
1413,stackoverflow,It does its job but was built for our use case ,pron do pron job but be build for pron use case ,1
1414,stackoverflow,That way you don t need to worry about API NAME ,that way pron do not need to worry about api name ,1
1415,stackoverflow,I wouldn t worry too much about memory consumption unless you either have an insane number of tracks or several different maps floating around ,pron would not worry too much about memory consumption unless pron either have an insane number of track or several different map float around ,1
1416,stackoverflow,I m not too certain that the CODE FRAGMENT solution is the best solution but I think far from the worst and should be pretty good on its own ,pron be not too certain that the code fragment solution be the good solution but pron think far from the bad and should be pretty good on pron own ,1
1417,stackoverflow,So this works ,so this work ,1
1418,stackoverflow,In lieu of that however in my experience ASM offers probably the best combination of maturity flexibility and ease of use ,in lieu of that however in pron experience asm offer probably the good combination of maturity flexibility and ease of use ,1
1419,stackoverflow,As others have already said JFormattedTextField is the best way to do this ,as other have already say jformattedtextfield be the good way to do this ,1
1420,stackoverflow,There is CODE FRAGMENT to convert XML to JSON and mongo can deal with this on it s own ,there be code fragment to convert xml to json and mongo can deal with this on pron be own ,1
1421,stackoverflow,Curiously you are doing it right for the CODE FRAGMENT property ,curiously pron be do pron right for the code fragment property ,1
1422,stackoverflow,Solved in case anyone stumbles upon similar problem ,solve in case anyone stumble upon similar problem ,1
1423,stackoverflow,Of course it will works fine if only you know how many tasks you have ,of course pron will work fine if only pron know how many task pron have ,1
1424,stackoverflow,This solution is more flexible ,this solution be more flexible ,1
1425,stackoverflow,but if you want you can do this ,but if pron want pron can do this ,1
1426,stackoverflow,I have FILE NAME that allows to download a file from the internet ,pron have file name that allow to download a file from the internet ,1
1427,stackoverflow,With use of API NAME all does work perfect ,with use of api name all do work perfect ,1
1428,stackoverflow,There are many ways to solve it the simplest is call ,there be many way to solve pron the simple be call ,1
1429,stackoverflow,The FILE NAME file will compile without and trouble ,the file name file will compile without and trouble ,1
1430,stackoverflow,You can use Gson library or any other to parse the json object FILE NAME object ,pron can use gson library or any other to parse the json object file name object ,1
1431,stackoverflow,Here s the official API on Java CODE FRAGMENT useful for quantifier syntax ,here be the official api on java code fragment useful for quantifi syntax ,1
1432,stackoverflow,The format CODE FRAGMENT can be used to convert any string of digits to the base CODE FRAGMENT ,the format code fragment can be use to convert any string of digit to the base code fragment ,1
1433,stackoverflow,In any case manually adding an instance of CODE FRAGMENT to the front of the filter chain in your test will solve the problem ,in any case manually add an instance of code fragment to the front of the filter chain in pron test will solve the problem ,1
1434,stackoverflow,The good news CODE FRAGMENT is true ,the good news code fragment be true ,1
1435,stackoverflow,The simplest solution would be to use Java 8 s Date Time API ,the simplest solution would be to use java 8 s date time api ,1
1436,stackoverflow,It seems after a quick google search that a popular solution to this is using CODE FRAGMENT ,pron seem after a quick google search that a popular solution to this be use code fragment ,1
1437,stackoverflow,This might prove to be useful unbescape ,this may prove to be useful unbescape ,1
1438,stackoverflow,Since all but the day of month in the line prefix is a fixed length the simplest solution is ,since all but the day of month in the line prefix be a fixed length the simplest solution be ,1
1439,stackoverflow,There is a good example showing how to put a file onto WebDAV server ,there be a good example show how to put a file onto webdav server ,1
1440,stackoverflow,Note There were no errors in the console and the CODE FRAGMENT function was working perfectly ,note there be no error in the console and the code fragment function be work perfectly ,1
1441,stackoverflow,That way you often don t need to implement CODE FRAGMENT at all manually ,that way pron often do not need to implement code fragment at all manually ,1
1442,stackoverflow,And running your CODE FRAGMENT will succeed ,and run pron code fragment will succeed ,1
1443,stackoverflow,Ok I finally figured out what I was looking for this link was also quite helpful ,ok pron finally figure out what pron be look for this link be also quite helpful ,1
1444,stackoverflow,Earlier I was writing the file to local machine then it was working fine ,earlier pron be write the file to local machine then pron be work fine ,1
1445,stackoverflow,That s correct behavior ,that be correct behavior ,1
1446,stackoverflow,I finally managed to get it to work ,pron finally manage to get pron to work ,1
1447,stackoverflow,Thank you dunni for your help you ve put me on the right path ,thank pron dunni for pron help pron have put pron on the right path ,1
1448,stackoverflow,And it works like a charm now SMILE FACE ,and pron work like a charm now smile face ,1
1449,stackoverflow,but you can use the very util FILE NAME like ,but pron can use the very util file name like ,1
1450,stackoverflow,Java doesn t have in built method on array to do slice but there are classes which can help you with it ,java do not have in build method on array to do slice but there be class which can help pron with pron ,1
1451,stackoverflow,FILE NAME under test uses FILE NAME that has a simple autowired configuration bean ,file name under test use file name that have a simple autowired configuration bean ,1
1452,stackoverflow,This answer describes what is happening more clearly ,this answer describe what be happen more clearly ,1
1453,stackoverflow,For example the following works great ,for example the follow work great ,1
1454,stackoverflow,It is able to handle all polygon cases including the self intersecting ones ,pron be able to handle all polygon case include the self intersect one ,1
1455,stackoverflow,Comparison time should be fast so total run time should be only slightly more than sum of run time for each ordered query ,comparison time should be fast so total run time should be only slightly more than sum of run time for each order query ,1
1456,stackoverflow,Congratulations ,congratulation ,1
1457,stackoverflow,Databases are much better at handling data than Java ,database be much good at handle datum than java ,1
1458,stackoverflow,Java is a fine general programming language but databases are optimized for relational data processing they just do it faster with less CPU less memory and less network traffic ,java be a fine general programming language but database be optimize for relational datum processing pron just do pron faster with less cpu less memory and less network traffic ,1
1459,stackoverflow,Embrace the Joy of Sets ,embrace the joy of set ,1
1460,stackoverflow,I understand the boolean expression here ,pron understand the boolean expression here ,1
1461,stackoverflow,If you are looking for a way to write to streams in a more intuitive way try CODE FRAGMENT ,if pron be look for a way to write to stream in a more intuitive way try code fragment ,1
1462,stackoverflow,This is not particularly unusual or wrong ,this be not particularly unusual or wrong ,1
1463,stackoverflow,Here s a knocked up utility to prove the point ,here be a knock up utility to prove the point ,1
1464,stackoverflow,it s worth a shot ,pron be worth a shot ,1
1465,stackoverflow,I heard like Java is the most suitable platform to develop that ,pron hear like java be the most suitable platform to develop that ,1
1466,stackoverflow,It s really good ,pron be really good ,1
1467,stackoverflow,It s an excellent fast library ,pron be an excellent fast library ,1
1468,stackoverflow,At least I can commit a project on OSX and update to Windows and it still works ,at least pron can commit a project on osx and update to windows and pron still work ,1
1469,stackoverflow,check API NAME it s the fastest way to copy part of an array FILE NAME ,check api name pron be the fast way to copy part of an array file name ,1
1470,stackoverflow,This works fine ,this work fine ,1
1471,stackoverflow,It ll be available in JSF by CODE FRAGMENT ,pron will be available in jsf by code fragment ,1
1472,stackoverflow,The following code therefore might be as I have not attempted using it a better one if you are willing to use Mojarra specific classes ,the follow code therefore may be as pron have not attempt use pron a good one if pron be willing to use mojarra specific class ,1
1473,stackoverflow,Better to use FILE NAME API there are several I am not sure which one is better it s more straightforward solution ,good to use file name api there be several pron be not sure which one be good pron be more straightforward solution ,1
1474,stackoverflow,But this gets optimized by the JIT and there is no measurable impact in production ,but this get optimize by the jit and there be no measurable impact in production ,1
1475,stackoverflow,I still think it s not the best design but I did quite a bit of testing and can say with a good bit of confidence that it had no real impact on performance ,pron still think pron be not the good design but pron do quite a bit of testing and can say with a good bit of confidence that pron have no real impact on performance ,1
1476,stackoverflow,Or since in NUMBER of cases day will be correct ,or since in number of case day will be correct ,1
1477,stackoverflow,The set can be a CODE FRAGMENT and you can wrap in an unmodifiable for good measure ,the set can be a code fragment and pron can wrap in an unmodifiable for good measure ,1
1478,stackoverflow,Even in your own parsing approach you can make it faster by returning the enum when you parse the list ,even in pron own parsing approach pron can make pron faster by return the enum when pron parse the list ,1
1479,stackoverflow,This should almost be obvious ,this should almost be obvious ,1
1480,stackoverflow,The application is complete and working fine ,the application be complete and work fine ,1
1481,stackoverflow,And this code worked ,and this code work ,1
1482,stackoverflow,Working Configuration ,working configuration ,1
1483,stackoverflow,There is a solution to your problem ,there be a solution to pron problem ,1
1484,stackoverflow,This configuration works very well ,this configuration work very well ,1
1485,stackoverflow, Hopefully with a good example , hopefully with a good example ,1
1486,stackoverflow,The maintainers rationale is covered in the JSF specification ,the maintainer rationale be cover in the jsf specification ,1
1487,stackoverflow,Also JodaTime makes calculations with time much simpler ,also jodatime make calculation with time much simple ,1
1488,stackoverflow,The option reduces heap usage ,the option reduce heap usage ,1
1489,stackoverflow,For workloads that are memory capacity constrained i e have to run with limited heap space and GC takes a lot of time this option can prove useful ,for workload that be memory capacity constrain i e have to run with limited heap space and gc take a lot of time this option can prove useful ,1
1490,stackoverflow,CharSequences can also be a lot more efficient to manipulate subsequences can be defined as views pointers onto the original content for example instead of copying ,charsequence can also be a lot more efficient to manipulate subsequence can be define as view pointer onto the original content for example instead of copying ,1
1491,stackoverflow,With the new design they could also support other encodings in future ,with the new design pron could also support other encoding in future ,1
1492,stackoverflow,API NAME can be used ,api name can be use ,1
1493,stackoverflow,Here s a good example from Jetty s wiki page WEB ADDRESS ,here be a good example from jetty s wiki page web address ,1
1494,stackoverflow,Using consistent indentation and sensible whitespace can make your code much easier to read ,use consistent indentation and sensible whitespace can make pron code much easy to read ,1
1495,stackoverflow,Very good example of steady pooling readHere ,very good example of steady pooling readhere ,1
1496,stackoverflow,Now we re getting to the good part ,now pron be get to the good part ,1
1497,stackoverflow,So far i ve done this for Twitter and it works very well ,so far pron have do this for twitter and pron work very well ,1
1498,stackoverflow,I solved the earlier problem ,pron solve the early problem ,1
1499,stackoverflow,Addendum CODE FRAGMENT is useful for managing lengthy background tasks while displaying interim progress ,addendum code fragment be useful for manage lengthy background task while display interim progress ,1
1500,appreviews,package file invalid i had my phone on factory reset and wanted to reinstall this app getting package file invalid error whats this all about i always loved im but now seems like im beginning to hate it pls fix this issue or tell me what to do this had been ongoing for 2 weeks now ,package file invalid i have pron phone on factory reset and want to reinstall this app get package file invalid error what s this all about i always love im but now seem like pron be begin to hate pron pls fix this issue or tell pron what to do this have be ongoing for 2 week now ,-1
1501,appreviews,iffy nice clean app but sometimes it works and other times it doesn t my os just updated and now it freezes all the time so i had to uninstall ,iffy nice clean app but sometimes pron work and other time pron do not pron os just update and now pron freeze all the time so i have to uninstall ,-1
1502,appreviews,cool just freezes everytime,cool just freeze everytime,-1
1503,appreviews,network error suddenly after downloading an update pack i cannot login and said that loading failed check your connection network but my connection is working finely please fix this thanks,network error suddenly after download an update pack i can not login and say that loading fail check pron connection network but pron connection be work finely please fix this thank,-1
1504,appreviews,annoying it let me choose the pictures i want then it freezes or force me to close it fix it,annoy pron let pron choose the picture i want then pron freeze or force pron to close pron fix pron,-1
1505,appreviews,anoying bug i use both the powertoggles notification bar widget and home screen widget really good concept as a whole but the home screen widget always freezes a couple hours after i configured it the widgetbis used to launch my favorite apps not for toggling anything if you want to resolve it i can try to give you more info ofc rating goes up if this is resolved bug doesn t occur anymore d,anoying bug i use both the powertoggle notification bar widget and home screen widget really good concept as a whole but the home screen widget always freeze a couple hour after i configure pron the widgetbis use to launch pron favorite app not for toggle anything if pron want to resolve pron i can try to give pron more info ofc rating go up if this be resolve bug do not occur anymore d,-1
1506,appreviews,resource error won t complete the d l it just freezes every time i open it,resource error will not complete the d l pron just freeze every time i open pron,-1
1507,appreviews,can t install i can t install it on my samsung note iii please fix it error 941 ,can not install i can not install pron on pron samsung note iii please fix pron error 941 ,-1
1508,appreviews,the most comprehensive but flawed i ve tried lots of other options none offer as good a selection of routing options and rerouting while driving had lots of issues with bugs from the start and used premium since the day of release it has got better but still freezes occasionally requiring task manager shut down this has been the same on every touchwiz rom on an s ii note and note ii funnily enough not on aosp roms ,the most comprehensive but flawed pron have try lot of other option none offer as good a selection of routing option and rerout while drive have lot of issue with bug from the start and use premium since the day of release pron have get good but still freeze occasionally require task manager shut down this have be the same on every touchwiz rom on an s ii note and note ii funnily enough not on aosp rom ,-1
1509,appreviews,crashed system stopped working no matter what i did this app kept crashing the system my phone wouldn t work the screen kept going black and i couldn t run anything happened all of a sudden uninstalled and went over to go launcher ex same features smoother not crashing even with more widgets running sorry adw ,crash system stop work no matter what i do this app keep crash the system pron phone would not work the screen keep go black and i could not run anything happen all of a sudden uninstalled and go over to go launcher ex same feature smooth not crash even with more widget run sorry adw ,-1
1510,appreviews,littlenikki tracks sometimes freezes or skips for some reason ,littlenikki track sometimes freeze or skip for some reason ,-1
1511,appreviews,bugs bugs and bugs the game would be really good but the application is full of bugs increasing at each release a pity ,bug bug and bug the game would be really good but the application be full of bug increase at each release a pity ,-1
1512,appreviews, i cant open the app and deactivate i want to unintall it plz help me, i can not open the app and deactivate i want to unintall pron plz help pron,-1
1513,appreviews,error i cant log in to my facebook when i try to log in this game is closed please fix it thanks,error i can not log in to pron facebook when i try to log in this game be close please fix pron thank,-1
1514,appreviews,for me it is super function some times it shows errors or late processing but most of the times its super fine good app strongly recommended this time unable to update due to error after downloading fix it,for pron pron be super function some time pron show error or late processing but most of the time pron super fine good app strongly recommend this time unable to update due to error after download fix pron,-1
1515,appreviews,last update good job but error after last update please fix it soon,last update good job but error after last update please fix pron soon,-1
1516,appreviews,nice but after i update i can t open the game pls fix this game and i love it i will give 5 star if this game fixed the bug username roenan12 server s2 libra,nice but after i update i can not open the game pls fix this game and i love it i will give 5 star if this game fix the bug username roenan12 server s2 libra,-1
1517,appreviews,stop button crash this app repatly fix that bug and u get 5 stars,stop button crash this app repatly fix that bug and u get 5 star,-1
1518,appreviews, i love it but some times it freezes and i have to do somthing else, i love pron but some time pron freeze and i have to do somthing else,-1
1519,appreviews,awesome but its a really good player no doubt but since last update some of my albums wont show and even songs wont show not to mention it repeats some albums and its not my memory card cause i only have 1 album for each group of songs please fix this its the best player ive come across id hate to have to uninstall it ,awesome but pron a really good player no doubt but since last update some of pron album will not show and even song will not show not to mention pron repeat some album and pron not pron memory card because i only have 1 album for each group of song please fix this pron the good player pron have come across pron would hate to have to uninstall pron ,0
1520,appreviews,freezes the game freezes alot please fix,freeze the game freeze alot please fix,-1
1521,appreviews, it do not open stops, pron do not open stop,-1
1522,appreviews,whyy i can t download plzzz fix my error,whyy i can not download plzzz fix pron error,-1
1523,appreviews,awesome connectivity but freezes freezes constantly on my s3 i m pretty upset i just paid 5 and cant even play out of fear of freezing losing all progress i d really appreciate it if tge devs would try to fix it,awesome connectivity but freeze freeze constantly on pron s3 pron be pretty upset i just pay 5 and can not even play out of fear of freeze lose all progress pron would really appreciate pron if tge devs would try to fix pron,-1
1524,appreviews,time time freezes and will not update since latest version ,time time freeze and will not update since late version ,-1
1525,appreviews,well it was awesome i do like the new look but now it also now gets unexpected errors and hitting retry just gets the same won t work til you clear the data out in settings but doing that all the time is annoying please fix this issue ,well pron be awesome i do like the new look but now pron also now get unexpected error and hit retry just get the same will not work til pron clear the datum out in setting but do that all the time be annoying please fix this issue ,-1
1526,appreviews,bug fix keep it up ,bug fix keep pron up ,0
1527,appreviews,great but i cannot see my device info gt power gt battery information please fix this it s really important to me thanks,great but i can not see pron device info gt power gt battery information please fix this pron be really important to pron thank,-1
