key,project,regular_text,text,oracle
690,stackoverflow,You ll need to customize the formatter s CODE FRAGMENT method since NumberFormat normally ignores trailing characters ,pron will need to customize the formatter s code fragment method since numberformat normally ignore trail character ,0
691,stackoverflow,What I would like to do take any random XML and create object which will contain timestamps integers strings as well maps basically it would be all decomposed based on the XML structure ,what pron would like to do take any random xml and create object which will contain timestamp integer string as well map basically pron would be all decompose base on the xml structure ,0
692,stackoverflow,Is there better way than to do it manually ,be there good way than to do pron manually ,0
693,stackoverflow,Component scan configuration file ,component scan configuration file ,0
694,stackoverflow,In a FILE NAME code base in my recent job I see the below code ,in a file name code base in pron recent job pron see the below code ,0
695,stackoverflow,Are there examples you have that could shed light on the above MapHelper s usefulness ,be there example pron have that could shed light on the above maphelper s usefulness ,0
696,stackoverflow,you could use ,pron could use ,0
697,stackoverflow,See also Is there a Java equivalent or methodology for the typedef keyword in C ,see also be there a java equivalent or methodology for the typedef keyword in c ,0
698,stackoverflow,They appear to have foresight about what the Map contains ,pron appear to have foresight about what the map contain ,0
699,stackoverflow,There are some examples like this in the Java API such as ,there be some example like this in the java api such as ,0
700,stackoverflow,Does anyone know what the C equivalents would be for the methods shown above ,do anyone know what the c equivalent would be for the method show above ,0
701,stackoverflow,XmlWriter forward only xml stream generator ,xmlwriter forward only xml stream generator ,0
702,stackoverflow,The API NAME file code is ,the api name file code be ,0
703,stackoverflow,When i run this API NAME their shows only the labels and No button aor text field ,when i run this api name pron show only the label and no button aor text field ,0
704,stackoverflow,Wrong JSF tags ,wrong jsf tag ,0
705,stackoverflow,In order to avoid such problems in future you d better use some IDE e g Netbeans IDE or Intellij IDEA ,in order to avoid such problem in future pron would better use some ide e g netbeans ide or intellij idea ,0
706,stackoverflow,Use CDI s CODE FRAGMENT with CODE FRAGMENT or JSF s CODE FRAGMENT with CODE FRAGMENT ,use cdi s code fragment with code fragment or jsf s code fragment with code fragment ,0
707,stackoverflow,You must capitalize the first letter of the property in the getter setter so instead of ,pron must capitalize the first letter of the property in the getter setter so instead of ,0
708,stackoverflow,Second you are mixing CODE FRAGMENT instantiation through JSF with CODE FRAGMENT ,second pron be mix code fragment instantiation through jsf with code fragment ,0
709,stackoverflow,Older versions of JSF used instantiation through JSF and you should be using CODE FRAGMENT ,old version of jsf use instantiation through jsf and pron should be use code fragment ,0
710,stackoverflow,Also to note when asking questions usually it is worth stating which version of JSF server J2EE you are using without such information we can not tell you which annotations you should use ,also to note when ask question usually pron be worth state which version of jsf server j2ee pron be use without such information pron can not tell pron which annotation pron should use ,0
711,stackoverflow,Do i need to use event mechanism ,do i need to use event mechanism ,0
712,stackoverflow,Use CODE FRAGMENT instead and get this string from a CODE FRAGMENT ,use code fragment instead and get this string from a code fragment ,0
713,stackoverflow,Check here for an example which returns a String ,check here for an example which return a string ,0
714,stackoverflow,Like this ,like this ,0
715,stackoverflow,If you insist using CODE FRAGMENT you can try the below 2 ways ,if pron insist use code fragment pron can try the below 2 way ,0
716,stackoverflow,Can anyone please help me out with this ,can anyone please help pron out with this ,0
717,stackoverflow,Hoping to get an alternate approach or a small overview of AnchorPane constraints ,hop to get an alternate approach or a small overview of anchorpane constraint ,0
718,stackoverflow,Note I m new to JavaFX graphics library ,note pron be new to javafx graphic library ,0
719,stackoverflow,running CODE FRAGMENT isn t enough running CODE FRAGMENT after inserting the dependency solved it for me ,run code fragment be not enough run code fragment after insert the dependency solve pron for pron ,0
720,stackoverflow,I would like to keep that original window open throughout when the user is using the File Chooser and after ,pron would like to keep that original window open throughout when the user be use the file chooser and after ,0
721,stackoverflow,The file chooser s parent was the main window ,the file chooser s parent be the main window ,0
722,stackoverflow,DO NOTHING ON CLOSE defined in WindowConstants Don t do anything require the program to handle the operation in the windowClosing method of a registered WindowListener object ,do nothing on close define in windowconstants do not do anything require the program to handle the operation in the windowclosing method of a registered windowlistener object ,0
723,stackoverflow,You absolutly need to be compiling FILE NAME JRE NUMBER ,pron absolutly need to be compile file name jre number ,0
724,stackoverflow,I created the simplest possible android app which starts the RegisterActivity generated by the plugin where I did plug the ID Api Key and project number ,pron create the simplest possible android app which start the registeractivity generate by the plugin where pron do plug the id api key and project number ,0
725,stackoverflow,I then click on the button but I get this error message ,pron then click on the button but pron get this error message ,0
726,stackoverflow,Although the console tells me that there is one instance up and running and the LOCAL ANDROID RUN variable in FILE NAME is set to false ,although the console tell pron that there be one instance up and run and the local android run variable in file name be set to false ,0
727,stackoverflow,How is that possible and what can I be doing wrong ,how be that possible and what can pron be do wrong ,0
728,stackoverflow,Thank you a lot in advance ,thank pron a lot in advance ,0
729,stackoverflow,The same number is 2 ,the same number be 2 ,0
730,stackoverflow,Use this logic it will work for consecutive same values otherwise use ArrayList ,use this logic pron will work for consecutive same value otherwise use arraylist ,0
731,stackoverflow,drl file for creating new rules and modifying rules ,drl file for create new rule and modify rule ,0
732,stackoverflow,What exists for programmatically creating new rules from Java ,what exist for programmatically create new rule from java ,0
733,stackoverflow,I don t know if this is the accepted way but with the following code I comine CODE FRAGMENT files with programmatically created rules in Drools 6 ,pron do not know if this be the accept way but with the follow code pron comine code fragment file with programmatically create rule in drool 6 ,0
734,stackoverflow,The following comment is found at the Java documentation ,the following comment be find at the java documentation ,0
735,stackoverflow,Adding API NAME after awaitTermination method call can provide a delay which can get you the output you were looking for ,add api name after awaittermination method call can provide a delay which can get pron the output pron be look for ,0
736,stackoverflow,I took help from this Question ,pron take help from this question ,0
737,stackoverflow,System prints data like this ,system print datum like this ,0
738,stackoverflow,If not I just wanted to know if Java serializes objects that haven t been initialized yet ,if not pron just want to know if java serialize object that have not be initialize yet ,0
739,stackoverflow,So basically you write primitives e g CODE FRAGMENT or objects CODE FRAGMENT with the CODE FRAGMENT and then you read them back using the CODE FRAGMENT with the corresponding CODE FRAGMENT methods ,so basically pron write primitive e g code fragment or object code fragment with the code fragment and then pron read pron back use the code fragment with the corresponding code fragment method ,0
740,stackoverflow,You can try use byte instead of String object ,pron can try use byte instead of str object ,0
741,stackoverflow,Each String object contains set of UTF 16 chars ,each str object contain set of utf 16 char ,0
742,stackoverflow,It means 2 bytes per symbol in most case ,pron mean 2 byte per symbol in most case ,0
743,stackoverflow,UTF 8 encoding uses one byte for ASCII two bytes for many europe languages ,utf 8 encoding use one byte for ascii two byte for many europe language ,0
744,stackoverflow,Also each String object contains reference to char array ,also each str object contain reference to char array ,0
745,stackoverflow,So you can easy reduce count of objects by factor two one byte instead of pair String char and array length of UTF 8 symbols usually less than length of UTF 16 chars ,so pron can easy reduce count of object by factor two one byte instead of pair string char and array length of utf 8 symbol usually less than length of utf 16 char ,0
746,stackoverflow,And then in your other file ,and then in pron other file ,0
747,stackoverflow,Assuming that the only issue you re having is the name of the dependent library see CODE FRAGMENT ,assume that the only issue pron be have be the name of the dependent library see code fragment ,0
748,stackoverflow,But this library has a dependency to other native library which cames bundled with the API NAME ,but this library have a dependency to other native library which cam bundle with the api name ,0
749,stackoverflow,In the debug outputs of JNA i can see only the API NAME will extract from FILE NAME package ,in the debug output of jna i can see only the api name will extract from file name package ,0
750,stackoverflow,I have looked to the JNA code of the extraction method ,pron have look to the jna code of the extraction method ,0
751,stackoverflow,Please see attached cause exception ,please see attached because exception ,0
752,stackoverflow,You don t you get Neo4j cross compiled to the client you have to run Neo4j as part of your backend service ,pron do not pron get neo4j cross compile to the client pron have to run neo4j as part of pron backend service ,0
753,stackoverflow,You can look at the readme document on Github repository to get started ,pron can look at the readme document on github repository to get start ,0
754,stackoverflow,Sample code on working with blob can also be found in the repository here ,sample code on work with blob can also be find in the repository here ,0
755,stackoverflow,I am using Android Studio ,pron be use android studio ,0
756,stackoverflow,The logcat is as below ,the logcat be as below ,0
757,stackoverflow,Can anyone tell me where I am going wrong ,can anyone tell pron where pron be go wrong ,0
758,stackoverflow,FILE NAME project is called Osmosis and contains 2 packages search and common ,file name project be call osmosis and contain 2 package search and common ,0
759,stackoverflow,My API NAME seems to include the reference ,pron api name seem to include the reference ,0
760,stackoverflow,Add CODE FRAGMENT after your other two CODE FRAGMENT lines in your CODE FRAGMENT ,add code fragment after pron other two code fragment line in pron code fragment ,0
761,stackoverflow,As well I am adding a set amount of Labels using an array and a for loop ,as well pron be add a set amount of labels use an array and a for loop ,0
762,stackoverflow,I have tried using both a VBox and an HBox but I am not able to see a difference in my result ,pron have try use both a vbox and an hbox but pron be not able to see a difference in pron result ,0
763,stackoverflow,I have also tried to use ,pron have also try to use ,0
764,stackoverflow, In this case I would have used , in this case pron would have use ,0
765,stackoverflow,Quick fix is to make the VBox as the parent of the StackPane ,quick fix be to make the vbox as the parent of the stackpane ,0
766,stackoverflow,so how we can parse above like example expression easier or FILE NAME api for string parser ,so how pron can parse above like example expression easy or file name api for string parser ,0
767,stackoverflow,This uses ByteBuffer s CODE FRAGMENT method ,this use bytebuffer s code fragment method ,0
768,stackoverflow,Now I want this when the user check a shipper by EditTextView I have from database an Object ,now pron want this when the user check a shipper by edittextview pron have from database an object ,0
769,stackoverflow,I want insert the information of this object in the Fragment ,pron want insert the information of this object in the fragment ,0
770,stackoverflow,Now in the onCreate method I have insert in all tab the FILE NAME but I will to create three FILE NAME for the three tabs ,now in the oncreate method pron have insert in all tab the file name but pron will to create three file name for the three tab ,0
771,stackoverflow,So instead of setting Bundle to null you can do something like this ,so instead of set bundle to null pron can do something like this ,0
772,stackoverflow,Check out this link for more info ,check out this link for more info ,0
773,stackoverflow,I did not remove sunpkcs 11 provider after each API NAME call ,pron do not remove sunpkcs 11 provider after each api name call ,0
774,stackoverflow,This exception is not because of absence of SunPkcs11 because i see the SunPkcs11 that i added in the providers list ,this exception be not because of absence of sunpkcs11 because i see the sunpkcs11 that i add in the provider list ,0
775,stackoverflow,I m new to FILE NAME language ,pron be new to file name language ,0
776,stackoverflow,In Java you typically don t write a single method that handle all sorts of arguments with all sorts of different types ,in java pron typically do not write a single method that handle all sort of argument with all sort of different type ,0
777,stackoverflow,Autoboxing is syntactic sugar ,autoboxing be syntactic sugar ,0
778,stackoverflow,If you want to implement a dynamic binding between names strings and values in Java use a FILE NAME ,if pron want to implement a dynamic binding between name string and value in java use a file name ,0
779,stackoverflow,So just use CODE FRAGMENT instead of CODE FRAGMENT ,so just use code fragment instead of code fragment ,0
780,stackoverflow,When I perform CODE FRAGMENT request to CODE FRAGMENT I get following JSON ,when pron perform code fragment request to code fragment pron get follow json ,0
781,stackoverflow,I am using library CODE FRAGMENT for work with CODE FRAGMENT file s ,pron be use library code fragment for work with code fragment file s ,0
782,stackoverflow,Then you can do what you want with the Collection sort it loop through it create a Comparator etc ,then pron can do what pron want with the collection sort pron loop through pron create a comparator etc ,0
783,stackoverflow,I was thinking of creating a new JSONArray object and copy node which contains Carlos ,pron be think of create a new jsonarray object and copy node which contain carlos ,0
784,stackoverflow,You ll need to use a regex for for the CODE FRAGMENT path expression ,pron will need to use a regex for for the code fragment path expression ,0
785,stackoverflow,I am doing a small project it is a interoperability FILE NAME and ,pron be do a small project pron be a interoperability file name and ,0
786,stackoverflow,The program is just a hello world Program ,the program be just a hello world program ,0
787,stackoverflow,You create a reference type by prefixing FILE NAME declaration with CODE FRAGMENT keyword ,pron create a reference type by prefix file name declaration with code fragment keyword ,0
788,stackoverflow,CODE FRAGMENT is what you use to create an object in managed heap ,code fragment be what pron use to create an object in manage heap ,0
789,stackoverflow, Note that nodes may have multiple style classes though I have never understood why this is a CODE FRAGMENT rather than a CODE FRAGMENT , note that node may have multiple style class though pron have never understand why this be a code fragment rather than a code fragment ,0
790,stackoverflow,Finally ID Selectors work by specifying an id on the node ,finally id selectors work by specify an pron would on the node ,0
791,stackoverflow,So you can do ,so pron can do ,0
792,stackoverflow,One last note you mentioned that your line lacked API NAME ,one last note pron mention that pron line lack api name ,0
793,stackoverflow,The code in Java is ,the code in java be ,0
794,stackoverflow,What you need is to assign data to a string read from the stream ,what pron need be to assign datum to a string read from the stream ,0
795,stackoverflow,This is a question just to satisfy my curiosity ,this be a question just to satisfy pron curiosity ,0
796,stackoverflow,Consider the following two Java regular expressions CODE FRAGMENT and CODE FRAGMENT ,consider the follow two java regular expression code fragment and code fragment ,0
797,stackoverflow,Are they equivalent ,be pron equivalent ,0
798,stackoverflow,I went on and assumed you meant to quantify it as greedy hence the CODE FRAGMENT in my example instead of non quantified CODE FRAGMENT in your question ,pron go on and assume pron mean to quantify pron as greedy hence the code fragment in pron example instead of non quantify code fragment in pron question ,0
799,stackoverflow,They are equivalent when you use them as is with CODE FRAGMENT ,pron be equivalent when pron use pron as be with code fragment ,0
800,stackoverflow,I like working with eclipse better than Android Studio ,pron like work with eclipse better than android studio ,0
801,stackoverflow,So I first tried to compile the sweet alert dialog project and I found out that I need to first somehow include the materialish progress ,so pron first try to compile the sweet alert dialog project and pron find out that pron need to first somehow include the materialish progress ,0
802,stackoverflow,Try to download ,try to download ,0
803,stackoverflow,May be some resources will need to be copied from archives too ,may be some resource will need to be copy from archive too ,0
804,stackoverflow,Let me know if there are any other details that might help ,let pron know if there be any other detail that may help ,0
805,stackoverflow,Dug this up WEB ADDRESS ,dig this up web address ,0
806,stackoverflow,Guess I ll be trying to find a creative workaround in the meantime The proximate cause of the failure is that there are more than 5 levels of subdirectories under ,guess pron will be try to find a creative workaround in the meantime the proximate because of the failure be that there be more than 5 level of subdirectory under ,0
807,stackoverflow,Provide path from src or bin to file location Running from eclipse ,provide path from src or bin to file location run from eclipse ,0
808,stackoverflow,For more Information WEB ADDRESS ,for more information web address ,0
809,stackoverflow,I needed to write a program which adds binary numbers as if they were decimal ,pron need to write a program which add binary number as if pron be decimal ,0
810,stackoverflow,If you want to print a int as binary use CODE FRAGMENT to get the string representation of a CODE FRAGMENT in binary ,if pron want to print a int as binary use code fragment to get the string representation of a code fragment in binary ,0
811,stackoverflow,Version of Spring is NUMBER ,version of spring be number ,0
812,stackoverflow,I have a session bean declared as ,pron have a session bean declare as ,0
813,stackoverflow,After debugging i found out that when test spring context is started in the ,after debug i find out that when test spring context be start in the ,0
814,stackoverflow,You can add a util method to your test something like ,pron can add a util method to pron test something like ,0
815,stackoverflow,In production I would assume that you are configuring either a CODE FRAGMENT or a CODE FRAGMENT ,in production pron would assume that pron be configure either a code fragment or a code fragment ,0
816,stackoverflow,See JIRA issue SPR 13217 for details ,see jira issue spr 13217 for detail ,0
817,stackoverflow,However having said that if you have a concrete need for modifying the mock request created by CODE FRAGMENT manually and then having that re used with CODE FRAGMENT you can create the FILE NAME in your project ,however have say that if pron have a concrete need for modify the mock request create by code fragment manually and then have that re use with code fragment pron can create the file name in pron project ,0
818,stackoverflow,Obviously the above example re implements CODE FRAGMENT but you can naturally do the same for CODE FRAGMENT etc ,obviously the above example re implement code fragment but pron can naturally do the same for code fragment etc ,0
819,stackoverflow,Sam author of the Spring TestContext Framework ,sam author of the spring testcontext framework ,0
820,stackoverflow,And DispatherConfig is this ,and dispatherconfig be this ,0
821,stackoverflow,Let s assume that we have a for loop that will loop through a collection or array of Strings ,let pron assume that pron have a for loop that will loop through a collection or array of strings ,0
822,stackoverflow,hey here s how I usually achieve that ,hey here be how pron usually achieve that ,0
823,stackoverflow,Let s put your code inside a method ,let pron put pron code inside a method ,0
824,stackoverflow,If you use CODE FRAGMENT the loop will terminate and CODE FRAGMENT will be reached ,if pron use code fragment the loop will terminate and code fragment will be reach ,0
825,stackoverflow,If you know the word can only be found once you can surely place an break statement so the loop won t continue after finding the match ,if pron know the word can only be find once pron can surely place an break statement so the loop will not continue after find the match ,0
826,stackoverflow,The application is a Spring Hibernate webApp which access the Oracle database ,the application be a spring hibernate webapp which access the oracle database ,0
827,stackoverflow,This was configured in an API NAME as follows ,this be configure in an api name as follow ,0
828,stackoverflow,Question is of course what is a solution to use the result of Oracle function for the new value of the ID ,question be of course what be a solution to use the result of oracle function for the new value of the id ,0
829,stackoverflow,Edit To call an Oracle function from Java see if this works for you ,edit to call an oracle function from java see if this work for pron ,0
830,stackoverflow,Call Java Oracle Functions From Java program and see the Java CallableStatement API ,call java oracle functions from java program and see the java callablestatement api ,0
831,stackoverflow,When I run this on Windows the console tells me ,when pron run this on windows the console tell pron ,0
832,stackoverflow,Does CODE FRAGMENT work ,do code fragment work ,0
833,stackoverflow,Note however it s called CODE FRAGMENT with a capital D ,note however pron be call code fragment with a capital d ,0
834,stackoverflow,Question 2 From the javadoc ,question 2 from the javadoc ,0
835,stackoverflow,So yes you need to keep track of the position yourself ,so yes pron need to keep track of the position pron ,0
836,stackoverflow,But when I run this json through CODE FRAGMENT I see that CODE FRAGMENT been replaced with CODE FRAGMENT ,but when pron run this json through code fragment pron see that code fragment be replace with code fragment ,0
837,stackoverflow,What happens if a thread has been executed same time more than once ,what happen if a thread have be execute same time more than once ,0
838,stackoverflow,Something like below ,something like below ,0
839,stackoverflow,Hope it clarifies ,hope pron clarify ,0
840,stackoverflow,I have to fetch time stamp from DB and retrieve only time and compare two time ,pron have to fetch time stamp from db and retrieve only time and compare two time ,0
841,stackoverflow,Which outputs ,which output ,0
842,stackoverflow,I have a string like this ,pron have a string like this ,0
843,stackoverflow,Now i want to translate the string FILE NAME entity decoder ,now i want to translate the string file name entity decoder ,0
844,stackoverflow,url WEB ADDRESS ,url web address ,0
845,stackoverflow,is there FILE NAME api to translate it ,be there file name api to translate pron ,0
846,stackoverflow,I m using it to convert huge lists of strings with HTML entities in them back to normal strings ,pron be use pron to convert huge list of string with html entity in pron back to normal string ,0
847,stackoverflow,And I got the output like this ,and pron get the output like this ,0
848,stackoverflow,mm stands for minutes ,mm stand for minute ,0
849,stackoverflow,So using It outputs CODE FRAGMENT for me ,so use pron output code fragment for pron ,0
850,stackoverflow,Accourding to this answer ,accourding to this answer ,0
851,stackoverflow,IS there any way so that I can open using the code itself ,be there any way so that pron can open use the code pron ,0
