key,project,regular_text,text,oracle
0,stackoverflow,But sadly this is not working ,but sadly this be not work ,-1
1,stackoverflow,So everything builds fine but when we try to deploy the application to GFNUMBER we get the FILE NAME file not found error ,so everything build fine but when pron try to deploy the application to gfnumber pron get the file name file not find error ,-1
2,stackoverflow,That is what is causing your null pointer exception ,that be what be cause pron null pointer exception ,-1
3,stackoverflow,All attempts I ve made were in a shortcut unsuccessful ,all attempt pron have make be in a shortcut unsuccessful ,-1
4,stackoverflow,Don t use ,do not use ,-1
5,stackoverflow,However when I try to run FILE NAME it gives The system cant find the path specified error for the batch file ,however when pron try to run file name pron give the system can not find the path specify error for the batch file ,-1
6,stackoverflow,Problem without zooming the added content doesn t get visible ,problem without zoom the add content do not get visible ,-1
7,stackoverflow,in a application you can workaround with scaling the window size but in an applet I wasn t able to solve that problem ,in a application pron can workaround with scale the window size but in an applet pron be not able to solve that problem ,-1
8,stackoverflow,else your GUI will be Hanged ,else pron gui will be hang ,-1
9,stackoverflow,I am not sure about Map implementation in HazelCast ,pron be not sure about map implementation in hazelcast ,-1
10,stackoverflow,But the above code doesn t work outside the FILE NAME JavaAgent FILE NAME of the main Agent ,but the above code do not work outside the file name javaagent file name of the main agent ,-1
11,stackoverflow,Please note there is a bug in FILE NAME L996 997 ,please note there be a bug in file name l996 997 ,-1
12,stackoverflow,I am not sure why I can not get it to work and have been struggling with it for a while ,pron be not sure why pron can not get pron to work and have be struggle with pron for a while ,-1
13,stackoverflow,the problem is the following ,the problem be the following ,-1
14,stackoverflow,When I run my client it throws the following exception ,when pron run pron client pron throw the follow exception ,-1
15,stackoverflow,i did come across the same issue with Java API NAME works in JDKNUMBER ,i do come across the same issue with java api name work in jdknumber ,-1
16,stackoverflow,I am unsure how to return an array that will avoid returning CODE FRAGMENT as an element of that array ,pron be unsure how to return an array that will avoid return code fragment as an element of that array ,-1
17,stackoverflow,This is the first time I ve encountered something like below ,this be the first time pron have encounter something like below ,-1
18,stackoverflow,NOT WORKING directly compiled the src on Unix machine and used FILE NAME files ,not work directly compile the src on unix machine and use file name file ,-1
19,stackoverflow,For some mystic reason the workflow is not enetering if Same exact code runs perfectly if I directly paste FILE NAME files from Eclipse s bin folder ,for some mystic reason the workflow be not eneter if same exact code run perfectly if pron directly paste file name file from eclipse s bin folder ,-1
20,stackoverflow,It might not reproduce consistently but at one point you might see the issue again ,pron may not reproduce consistently but at one point pron may see the issue again ,-1
21,stackoverflow,Still that does not guarantee that the first thread will run and only then the second one will check if the size 0 ,still that do not guarantee that the first thread will run and only then the second one will check if the size 0 ,-1
22,stackoverflow,Eclipse error Failed to create the Java Virtual Machine ,eclipse error fail to create the java virtual machine ,-1
23,stackoverflow,But unfortunately it can not be used ,but unfortunately pron can not be use ,-1
24,stackoverflow,Maybe there are some problems with the path of the file on my pc ,maybe there be some problem with the path of the file on pron pc ,-1
25,stackoverflow, but no such thing exists , but no such thing exist ,-1
26,stackoverflow,After entering the details when the button is clicked the entered data must be displayed as shown below but I am not sure how to align it ,after enter the detail when the button be click the enter datum must be display as show below but pron be not sure how to align pron ,-1
27,stackoverflow,But the file output messes with the chinese characters ,but the file output mess with the chinese character ,-1
28,stackoverflow,Not related ,not related ,-1
29,stackoverflow,Not even sure what JSR that is ,not even sure what jsr that be ,-1
30,stackoverflow,I had the same issue using a remote postgres instance ,pron have the same issue use a remote postgre instance ,-1
31,stackoverflow,I would avoid to generate the full XML String see AdriaanKoster response ,pron would avoid to generate the full xml string see adriaankoster response ,-1
32,stackoverflow,I wanted to see all the files I have in my external storage I have this library that display the text to the user but when I m using it to show the sub files it says something like ,pron want to see all the file pron have in pron external storage pron have this library that display the text to the user but when pron be use pron to show the sub file pron say something like ,-1
33,stackoverflow,A workaround might be to use reflection however this isn t a generally recommended approach for a number of reasons brittleness performance problems breaking encapsulation etc ,a workaround may be to use reflection however this be not a generally recommend approach for a number of reason brittleness performance problem break encapsulation etc ,-1
34,stackoverflow,That can hide an error and keep you searching for dogs a whole week while the problem was really a cat ch ,that can hide an error and keep pron search for dog a whole week while the problem be really a cat ch ,-1
35,stackoverflow,AS I know it s impossible in the case ,as pron know pron be impossible in the case ,-1
36,stackoverflow,It is not advisable to avoid an exception with an empty catch block even though you are completely sure that is not going to fail under any circumstance ,pron be not advisable to avoid an exception with an empty catch block even though pron be completely sure that be not go to fail under any circumstance ,-1
37,stackoverflow,You are really asking too much of the Java runtime and Jackson library by trying to make them infer all the required information about the type to be instantiated based on the parameterized return ,pron be really ask too much of the java runtime and jackson library by try to make pron infer all the require information about the type to be instantiate base on the parameterized return ,-1
38,stackoverflow,Server not starting in Eclipse Gallileo IDE with WAS7 ,server not start in eclipse gallileo ide with was7 ,-1
39,stackoverflow,Your API NAME is messed up and doesn t list dependencies properly ,pron api name be mess up and do not list dependency properly ,-1
40,stackoverflow,Without that information you have to start the debugging process by guessing ,without that information pron have to start the debug process by guess ,-1
41,stackoverflow,so I m not happy with it ,so pron be not happy with pron ,-1
42,stackoverflow,Connections on the other hand are expensive and need to be managed carefully by the application ,connection on the other hand be expensive and need to be manage carefully by the application ,-1
43,stackoverflow,i try to return an output type date in a web service but i receive a weird result ,i try to return an output type date in a web service but i receive a weird result ,-1
44,stackoverflow,My previous code example used CODE FRAGMENT to fuse the filter and map operations but this was cumbersome and provided no advantage ,pron previous code example use code fragment to fuse the filter and map operation but this be cumbersome and provide no advantage ,-1
45,stackoverflow,At the moment I am receiving a ClassNotFoundException to API NAME ,at the moment pron be receive a classnotfoundexception to api name ,-1
46,stackoverflow,I added it into my ANT HOME lib directory but it didn t have any effect ,pron add pron into pron ant home lib directory but pron do not have any effect ,-1
47,stackoverflow,It didn t make any difference I receive the same error ,pron do not make any difference pron receive the same error ,-1
48,stackoverflow,An SQL EXCEPTION is being caught saying API NAME Microsoft ODBC Driver Manager Data source name not found and no default driver specified ,an sql exception be be catch say api name microsoft odbc driver manager data source name not find and no default driver specify ,-1
49,stackoverflow,If you ve created your File IO and pulled from it in a weird way you can corrupt the encoding of the key material ,if pron have create pron file io and pull from pron in a weird way pron can corrupt the encoding of the key material ,-1
50,stackoverflow,But the exception is occurring ,but the exception be occur ,-1
51,stackoverflow,i m having a difficult time figuring out to properly sort arraylists FILE NAME though ,pron be have a difficult time figure out to properly sort arraylist file name though ,-1
52,stackoverflow,I don t have any code to show because I don t know where to start ,pron do not have any code to show because pron do not know where to start ,-1
53,stackoverflow,I am not able to find any documentation or info ,pron be not able to find any documentation or info ,-1
54,stackoverflow,I tried to download API NAME file but I am not getting the file on net ,pron try to download api name file but pron be not get the file on net ,-1
55,stackoverflow,I found API NAME but that is for Ubuntu and not for Windows ,pron find api name but that be for ubuntu and not for windows ,-1
56,stackoverflow,I find this error when I am trying to open this file ,pron find this error when pron be try to open this file ,-1
57,stackoverflow,There are many errors in this code ,there be many error in this code ,-1
58,stackoverflow,Used wrong column names which does not exist in the table ,used wrong column name which do not exist in the table ,-1
59,stackoverflow,It s ugly and inefficient but it should work ,pron be ugly and inefficient but pron should work ,-1
60,stackoverflow,Anyway their current behavior does not allow what you want ,anyway pron current behavior do not allow what pron want ,-1
61,stackoverflow,It seems that there must be some problem when genereting the response ,pron seem that there must be some problem when generet the response ,-1
62,stackoverflow,I can successfully call my service but when generating the response it seems to crash ,pron can successfully call pron service but when generate the response pron seem to crash ,-1
63,stackoverflow,But as far as I create the entitymanager which not necessary has anything to do with the response it crashes I still respond with just 200 ,but as far as pron create the entitymanager which not necessary have anything to do with the response pron crash pron still respond with just 200 ,-1
64,stackoverflow,The following warning messages should be ignored they are false positive alert messages ,the follow warning message should be ignore pron be false positive alert message ,-1
65,stackoverflow,Since this afternoon it have started to give an error and the process ends leaving to process thousands of files ,since this afternoon pron have start to give an error and the process end leave to process thousand of file ,-1
66,stackoverflow,Its a little complicated there is a full example in this loadNativeLibrary method ,pron a little complicated there be a full example in this loadnativelibrary method ,-1
67,stackoverflow,Here is an example I don t understand ,here be an example pron do not understand ,-1
68,stackoverflow,Bear in mind that the above code might not compile I haven t tried it out myself ,bear in mind that the above code may not compile pron have not try pron out pron ,-1
69,stackoverflow,Not sure why but I am getting following error from my FILE NAME ,not sure why but pron be get follow error from pron file name ,-1
70,stackoverflow,The important different between these two approaches is that with the multi threaded example there s no guarantee of processing order ,the important different between these two approach be that with the multi threaded example there be no guarantee of processing order ,-1
71,stackoverflow,since a day I have a very annoying problem I can t run any Spring MVC application Today I have tried to write something basing at Spring Documentation ,since a day pron have a very annoying problem pron can not run any spring mvc application today pron have try to write something base at spring documentation ,-1
72,stackoverflow,Any idea what i might be doing wrong ,any idea what i may be do wrong ,-1
73,stackoverflow,I think that you have a problem described in this bug report ,pron think that pron have a problem describe in this bug report ,-1
74,stackoverflow,Someone on StackOverflow had similar problem ,someone on stackoverflow have similar problem ,-1
75,stackoverflow,i am trying with Jackson but im getting no suitable output ,i be try with jackson but pron be get no suitable output ,-1
76,stackoverflow,I m a little worried that they use a busy waiting mechanism as it would produce a lot of overhead ,pron be a little worried that pron use a busy wait mechanism as pron would produce a lot of overhead ,-1
77,stackoverflow,I don t want to get the last token and reuse it for the next query it does not make a sense since I want to use batch ,pron do not want to get the last token and reuse pron for the next query pron do not make a sense since pron want to use batch ,-1
78,stackoverflow,Less margin for error ,less margin for error ,-1
79,stackoverflow,Wrong CODE FRAGMENT CODE FRAGMENT attribute ,wrong code fragment code fragment attribute ,-1
80,stackoverflow,I was unable to get a perfect match ,pron be unable to get a perfect match ,-1
81,stackoverflow,I am not able to deploy my App Engine project locally ,pron be not able to deploy pron app engine project locally ,-1
82,stackoverflow,You absolutly need to be compiling FILE NAME JRE NUMBER ,pron absolutly need to be compile file name jre number ,-1
83,stackoverflow,There is of course an API for the DRL compiler s parser but it isn t stable and as complex as DRL rule syntax which is considerable ,there be of course an api for the drl compiler s parser but pron be not stable and as complex as drl rule syntax which be considerable ,-1
84,stackoverflow,I m having trouble figuring out how to do this in drools 6 ,pron be have trouble figure out how to do this in drool 6 ,-1
85,stackoverflow,But this refernce doesn t solve my problem ,but this refernce do not solve pron problem ,-1
86,stackoverflow,This is an absurd unreasonable and frankly ridiculous requirement I can t imagine what use such a data structure would be good for ,this be an absurd unreasonable and frankly ridiculous requirement pron can not imagine what use such a data structure would be good for ,-1
87,stackoverflow,First of all I do not think you need all these ,first of all pron do not think pron need all these ,-1
88,stackoverflow,This means it was not possible to resolve the dependencies of the API NAME to the API NAME ,this mean pron be not possible to resolve the dependency of the api name to the api name ,-1
89,stackoverflow,But now I think the problem is JNA creats temp files for the native librarys wit jna prefix and a unique generated numeric value ,but now pron think the problem be jna creat temp file for the native library wit jna prefix and a unique generate numeric value ,-1
90,stackoverflow,then I gets the module error again from JNA ,then pron get the module error again from jna ,-1
91,stackoverflow,This line gives the error ,this line give the error ,-1
92,stackoverflow,I am using standout library I added a videoView in it Everything is running correctly Except if i click on video then mediaController Is not Showing and i am getting null pointer exception ,pron be use standout library pron add a videoview in pron everything be run correctly except if i click on video then mediacontroller be not show and i be get null pointer exception ,-1
93,stackoverflow,And an CODE FRAGMENT argument type can never accept a CODE FRAGMENT ,and an code fragment argument type can never accept a code fragment ,-1
94,stackoverflow,But the underlying hard distinction between primitive and reference types remains ,but the underlie hard distinction between primitive and reference type remain ,-1
95,stackoverflow,You have problem with classpath ,pron have problem with classpath ,-1
96,stackoverflow,Only the LoginHandler fails to compile ,only the loginhandler fail to compile ,-1
97,stackoverflow,I can not read correctly a CODE FRAGMENT and i have charset problem ,pron can not read correctly a code fragment and i have charset problem ,-1
98,stackoverflow,If I give the 2 input given below it is showing an error ,if pron give the 2 input give below pron be show an error ,-1
99,stackoverflow,does not work without previously setting the FILE NAME ,do not work without previously set the file name ,-1
100,stackoverflow,They all fail with the following error ,pron all fail with the follow error ,-1
101,stackoverflow,The following is the error I keep getting ,the follow be the error pron keep get ,-1
102,stackoverflow,But it isn t working like I expected ,but pron be not work like pron expect ,-1
103,stackoverflow,But unexpectedly I am getting 66 ,but unexpectedly pron be get 66 ,-1
104,stackoverflow,As an aside configuring the CODE FRAGMENT that is created by the CODE FRAGMENT is not supported ,as an aside configure the code fragment that be create by the code fragment be not support ,-1
105,stackoverflow,Why is it reading it wrongly ,why be pron read pron wrongly ,-1
106,stackoverflow,The error is as shown below ,the error be as show below ,-1
107,stackoverflow,Exception in thread main API NAME Uncompilable source code Erroneous tree type ,exception in thread main api name uncompilable source code erroneous tree type ,-1
108,stackoverflow,I don t know if it is possible to show timer on cards ,pron do not know if pron be possible to show timer on card ,-1
109,stackoverflow,The problem is that when reader contains CODE FRAGMENT it is not reporting ready ,the problem be that when reader contain code fragment pron be not report ready ,-1
110,stackoverflow,I tried the following and it returns nothing ,pron try the follow and pron return nothing ,-1
111,stackoverflow,I searched a lot but i not found any solution ,pron search a lot but i not find any solution ,-1
112,stackoverflow,What I don t understand is if one thread is still stuck deadlocked inside CODE FRAGMENT then how come all the other threads were able to get past the CODE FRAGMENT call ,what pron do not understand be if one thread be still stick deadlock inside code fragment then how come all the other thread be able to get past the code fragment call ,-1
113,stackoverflow,When I tried to compile the tool I get n error ,when pron try to compile the tool pron get n error ,-1
114,stackoverflow,I don t know what else to do to make things to work ,pron do not know what else to do to make thing to work ,-1
115,stackoverflow,I think the actual CODE FRAGMENT would be a little more complicated to simplify ,pron think the actual code fragment would be a little more complicated to simplify ,-1
116,stackoverflow,I have created a custom MenuBar in my Processing sketch using Eclipse as my IDE but it is not displaying ,pron have create a custom menubar in pron processing sketch use eclipse as pron ide but pron be not display ,-1
117,stackoverflow,I expected there to be a CODE FRAGMENT Menu in the CODE FRAGMENT but there is none ,pron expect there to be a code fragment menu in the code fragment but there be none ,-1
118,stackoverflow,but still nothing ,but still nothing ,-1
119,stackoverflow,But it s not necessary for our case ,but pron be not necessary for pron case ,-1
120,stackoverflow,Java JTextPane JScrollPane Display Issue ,java jtextpane jscrollpane display issue ,-1
121,stackoverflow,I suspect there may not be a good solution for this right now ,pron suspect there may not be a good solution for this right now ,-1
122,stackoverflow,I thought that the problem was the id null ,pron think that the problem be the pron would null ,-1
123,stackoverflow,I haven t used EclipseLink myself so all I can do is guess but what surprises me is that FILE NAME doesn t have a setter for the id property ,pron have not use eclipselink pron so all pron can do be guess but what surprise pron be that file name do not have a setter for the pron would property ,-1
124,stackoverflow,I learned that such beans are proxied using CGLib but still can not figure out how proxy can handle thread ,pron learn that such bean be proxi use cglib but still can not figure out how proxy can handle thread ,-1
125,stackoverflow,This is your problem ,this be pron problem ,-1
126,stackoverflow,This is not my intention ,this be not pron intention ,-1
127,stackoverflow,I guess my approach is wrong so I d appreciate some guidance ,pron guess pron approach be wrong so pron would appreciate some guidance ,-1
128,stackoverflow,This isn t valid Java ,this be not valid java ,-1
129,stackoverflow,Well the funny part is we do not know ,well the funny part be pron do not know ,-1
130,stackoverflow,The data structure you are saving your data is not very optimal for the days with daylight saving time ,the data structure pron be save pron data be not very optimal for the day with daylight saving time ,-1
131,stackoverflow,This is part of the code which was working fine and now it s not ,this be part of the code which be work fine and now pron be not ,-1
132,stackoverflow,The exception is throw on CODE FRAGMENT ,the exception be throw on code fragment ,-1
133,stackoverflow,I ve notice that some of the feeds had false value ,pron have notice that some of the feed have false value ,-1
134,stackoverflow,The problem is that you wrote ,the problem be that pron write ,-1
135,stackoverflow,I wrote this code to update a patient in a derby database but it throws a CODE FRAGMENT ,pron write this code to update a patient in a derby database but pron throw a code fragment ,-1
136,stackoverflow,I understand why you tried CODE FRAGMENT but with the fix above we no longer need that we can just declare it CODE FRAGMENT ,pron understand why pron try code fragment but with the fix above pron no longer need that pron can just declare pron code fragment ,-1
137,stackoverflow,Your CODE FRAGMENT method calls itself recursively leading to an infinite recursion ,pron code fragment method call pron recursively lead to an infinite recursion ,-1
138,stackoverflow,CGLIB proxy did not work for my case ,cglib proxy do not work for pron case ,-1
139,stackoverflow,Problems creating JAXBContext to marshal object as XML ,problem create jaxbcontext to marshal object as xml ,-1
140,stackoverflow,I m about to hang myself with the little rope I have left ,pron be about to hang pron with the little rope pron have leave ,-1
141,stackoverflow,Here is a demo for the naive implementation which doesn t work ,here be a demo for the naive implementation which do not work ,-1
142,stackoverflow,Because it s not initialized yet ,because pron be not initialize yet ,-1
143,stackoverflow, So the problem is CODE FRAGMENT , so the problem be code fragment ,-1
144,stackoverflow,I need all subclasses to execute CODE FRAGMENT but I can t rely on them doing it explicitly ,pron need all subclass to execute code fragment but pron can not rely on pron do pron explicitly ,-1
145,stackoverflow,Since this is correct why byte code noting down the return type of the called method and raising error when the library is updated with a return type for the method ,since this be correct why byte code note down the return type of the call method and raise error when the library be update with a return type for the method ,-1
146,stackoverflow,Data loss ,datum loss ,-1
147,stackoverflow,When I run the project I get the following error ,when pron run the project pron get the follow error ,-1
148,stackoverflow,As you can see the translucent text is clearly standard AA and rather than a clean translucent rendering it has that awful 90s spidery appearance ,as pron can see the translucent text be clearly standard aa and rather than a clean translucent rendering pron have that awful 90s spidery appearance ,-1
149,stackoverflow,As others have stated this is not an issue with JPA hibernate but rather with the json serialization library you are using ,as other have state this be not an issue with jpa hibernate but rather with the json serialization library pron be use ,-1
150,stackoverflow,We ran into the same sort of problem with Flex and JPA Hibernate ,pron run into the same sort of problem with flex and jpa hibernate ,-1
151,stackoverflow,All seems OK but I get a NullPointerException NPE ,all seem ok but pron get a nullpointerexception npe ,-1
152,stackoverflow, Which brings me to the only downside I found it might take a little while to wrap your head around TrueZIP , which bring pron to the only downside pron find pron may take a little while to wrap pron head around truezip ,-1
